{
  "unit_id": "grdr:deep-map-unit:source-dataset",
  "spine": "structural",
  "state": "mapped_complete",
  "expected_node_count": 4,
  "node_ids": [
    "grdr:dataset:source-dataset",
    "grdr:data-structure:source-dataset-structure",
    "grdr:data-element:source-dataset-measure",
    "grdr:variable:source-dataset-variable"
  ],
  "verified_node_count": 0,
  "expected_edge_count": 3,
  "edge_ids": [
    "grdr:relationship:source-dataset-organized-as-source-dataset-structure",
    "grdr:relationship:source-dataset-structure-defines-source-dataset-measure",
    "grdr:relationship:source-dataset-measure-operationalizes-source-dataset-variable"
  ],
  "verified_edge_count": 0,
  "root_node_ids": ["grdr:dataset:source-dataset"],
  "leaf_node_ids": ["grdr:variable:source-dataset-variable"],
  "topology_fingerprint": null,
  "completion_basis": "Every node and edge in the locked source-native structural universe is registered; the command computes the topology fingerprint and canonical verification counts.",
  "evidence": [
    {
      "url": "https://example.org/official-schema",
      "title": "Official schema",
      "evidence_type": "official_schema",
      "supports": ["native_topology", "node_universe", "edge_universe"],
      "retrieved_at": "2026-08-20T00:00:00Z"
    }
  ],
  "blockers": [],
  "checkpoint": {
    "enumeration_rule": "Official schema order at the declared snapshot",
    "completed_native_count": 4,
    "last_native_id": "source-dataset-variable",
    "next_native_id": null,
    "snapshot": "2026-08-20T00:00:00Z",
    "cursor_checksum": null
  }
}
